111;Všeobecná zdravotní pojišovna Èeské republiky;Orlická 2020/4, Vinohrady 130 00 Praha 3;i48ae3q;952222222;info@vzp.cz
201;Vojenská zdravotní pojišovna Èeské republiky;Drehobejova 1404/4 190 00 Praha 9;p3aaext;222929199;info@vozp.cz
205;Èeská prùmyslová zdravotní pojišovna;Jeremenkova 161/11, Vítkovice 703 00 Ostrava;mk5ab8i;810800000;posta@cpzp.cz
207;Oborová zdravotní pojišovna zamìstnancù bank, pojišoven a stavebnictví;Roškotova 1225/1 140 00 Praha 4;q9iadw9;261105555;info@ozp.cz
209;Zamìstnanecká pojišovna Škoda;Husova 302 293 01 Mladá Boleslav;5kpadkp;326579111;zpskoda@zpskoda.cz
211;Zdravotní pojišovna ministerstva vnitra Èeské republiky;Vinohradská 2577/178, Vinohrady 130 00 Praha 3;9swaix3;233002111;info@zpmvcr.cz
213;Revírní bratrská pokladna, zdravotní pojišovna;Michálkovická 967/108, Slezská Ostrava 710 00 Ostrava;edyadmh;800213213;rbp@rbp213.cz
